{
  "agents_used": [],
  "budget": {
    "budget_limit": 6,
    "budget_override": false,
    "budget_override_reason": null,
    "budget_used": 0,
    "hard_max_model_calls": 8,
    "max_agents": 6,
    "max_duration_ms": 3600000,
    "max_model_calls": 6,
    "max_parallel_agents": 2,
    "model_calls_used": 0,
    "progress_events": 0,
    "required_reviewers": [
      "technical_qa_or_diff_auditor"
    ]
  },
  "complexity": "CRITICAL",
  "config_hash": "f3b4fb4f650bb3e3e04095563eb6c2d9782eb12316e637f2fe61a29e6818e0e7",
  "context_usage": {
    "estimated_tokens": 0,
    "files": 0,
    "limit_hits": 0,
    "limits": {
      "max_context_tokens": 100000,
      "max_files": 30,
      "max_raw_bytes": 1500000,
      "max_tool_reads": 60
    },
    "mode": "OBSERVE_ONLY",
    "raw_bytes": 0,
    "tool_reads": 0
  },
  "contracts_version": "3.1.0",
  "cost_budget": {
    "limit_hits": 0,
    "max_credits": 60,
    "max_uncached_input_tokens": 300000,
    "mode": "OBSERVE_ONLY",
    "soft_limit_ratio": 0.8,
    "status": "ALLOW"
  },
  "created_at": "2026-09-07T12:37:03.092Z",
  "current_state": "NEW",
  "execution_path": "STANDARD",
  "finished_at": null,
  "gate_attempts": 0,
  "gate_decision": null,
  "gate_reason_code": null,
  "gate_reason_detail": null,
  "history": [
    {
      "at": "2026-09-07T12:37:03.092Z",
      "from": null,
      "reason": "run initialized",
      "stop_reason": null,
      "to": "NEW"
    }
  ],
  "jarvis_version": "3.1.0",
  "metrics": {
    "agent_invocation_count": 0,
    "cached_input_tokens": 0,
    "credits": 0.0,
    "duration_ms": 7,
    "first_pass_success": null,
    "handoff_count": 0,
    "human_gate_pass_on_first_attempt": null,
    "input_tokens": 0,
    "output_tokens": 0,
    "retry_count": 0,
    "rework_cycles": 0,
    "stop_count": 0,
    "stop_reasons": {}
  },
  "operational_mode": "ASSISTED_AUTOPILOT",
  "policy_version": "3.1.0",
  "rag": {
    "cache_hits": 0,
    "cache_misses": 0,
    "enabled": true,
    "estimated_tokens": 0,
    "last_context_pack": null,
    "last_query_id": null,
    "policy_version": "1.0.0",
    "queries": 0,
    "selected_chunks": 0
  },
  "reasoning": {
    "attempts_used": 0,
    "context_budget": "LARGE",
    "contributions": {
      "ambiguity": 1.0,
      "architectural": 3,
      "complexity": 4.0,
      "database_migration": 0,
      "many_files": 2,
      "multiple_modules": 2,
      "production_critical": 0,
      "security_sensitive": 0,
      "tests_required": 1
    },
    "current_level": "HIGH",
    "effective_effort": null,
    "effective_model": null,
    "escalation_allowed": false,
    "escalations_used": 0,
    "final_level": null,
    "initial_level": "HIGH",
    "last_escalation_reason": null,
    "max_attempts": 3,
    "max_child_depth": 3,
    "max_escalations": 1,
    "max_input_tokens": 160000,
    "policy_version": "3.1.0",
    "requested_effort": "high",
    "requested_model": "gpt-5.6-sol",
    "score": 13.0,
    "signals": {
      "ambiguity_score": 1.0,
      "architectural": true,
      "complexity_score": 4.0,
      "database_migration": false,
      "estimated_files": 33,
      "estimated_modules": 4,
      "production_critical": false,
      "security_sensitive": false,
      "task_type": "ARCHITECTURE",
      "tests_required": true
    },
    "termination_reason": null
  },
  "reasoning_class": "DEEP",
  "registry_version": "1.1.0",
  "risk_class": "MEDIUM",
  "routing": {
    "agents_invoked": [],
    "agents_planned": [],
    "agents_rejected_by_budget": [],
    "agents_skipped": [],
    "missing_agents": [],
    "parallel_batches": 0,
    "routing_outcome": "UNKNOWN",
    "unnecessary_agents": []
  },
  "run_id": "jarvis-20260907T123703Z-32061b19",
  "schema_version": "3.1.0",
  "started_at": "2026-09-07T12:37:03.092Z",
  "task_id": "JARVIS-TEAMS-1",
  "teams": {
    "completed": [],
    "current": null,
    "planned": [],
    "runs": {}
  },
  "telemetry_db": "/home/luisbiset/desenvolvimento/projetos/jarvis-agent/.jarvis/telemetry/jarvis.db",
  "updated_at": "2026-09-07T12:37:03.099Z"
}
